{
  "schema_version": "1.0.0",
  "run_id": "deterministic_runtime_bench_vm_perf_2026-02-08",
  "suite": "deterministic_runtime_bench",
  "timestamp_utc": "2026-02-08T20:01:03Z",
  "git_commit": "fdbdc5ecc8434f841db9a3ed7795907b99911924",
  "profile_id": "github-ubuntu-latest-x64",
  "inputs": {
    "workload": "interpreter_loop_add_dec_jump",
    "runtime": {
      "binary": "t81vm",
      "mode": "interpreter",
      "max_steps": 650000
    },
    "program": {
      "format": "TextV1",
      "iterations": 200000,
      "expected_steps": 600003
    }
  },
  "metrics": {
    "median_instructions_per_sec": 7677724.912794936,
    "min_observed_instructions_per_sec": 7046258.454292456,
    "baseline_floor_instructions_per_sec": 2000000.0,
    "median_seconds": 0.0781485409825109
  },
  "outcome": {
    "status": "completed",
    "notes": "Imported from t81-vm perf regression report generated by scripts/perf-regression-check.py."
  }
}
